{
  "title": "data/surahs.json",
  "$schema": "https://json-schema.org/draft/2020-12/schema",
  "type": "array",
  "items": {
    "type": "object",
    "properties": {
      "id": {
        "type": "string",
        "pattern": "^\\d{1,3}$"
      },
      "number": {
        "type": "integer",
        "exclusiveMinimum": 0,
        "maximum": 114
      },
      "transliteration": {
        "type": "string",
        "minLength": 1
      },
      "name": {
        "type": "object",
        "properties": {
          "en": {
            "type": "string",
            "minLength": 1
          },
          "ar": {
            "type": "string",
            "minLength": 1
          },
          "ur": {
            "type": "string",
            "minLength": 1
          }
        },
        "required": ["en", "ar", "ur"]
      },
      "revelation": {
        "type": "string",
        "enum": ["meccan", "medinan"]
      },
      "ayahCount": {
        "type": "integer",
        "exclusiveMinimum": 0,
        "maximum": 9007199254740991
      },
      "image": {
        "type": "string",
        "pattern": "^surah_\\d{3}\\.png$"
      },
      "notes": {
        "type": "string",
        "minLength": 1
      }
    },
    "required": ["id", "number", "transliteration", "name", "revelation", "ayahCount", "image"]
  }
}
