[
  {
    "id": "1",
    "number": 1,
    "transliteration": "Al-Fatihah",
    "name": {
      "en": "The Opener",
      "ar": "الفاتحة",
      "ur": "کھولنے والی"
    },
    "revelation": "meccan",
    "ayahCount": 7,
    "image": "surah_001.png"
  },
  {
    "id": "2",
    "number": 2,
    "transliteration": "Al-Baqarah",
    "name": {
      "en": "The Cow",
      "ar": "البقرة",
      "ur": "گائے"
    },
    "revelation": "medinan",
    "ayahCount": 286,
    "image": "surah_002.png"
  },
  {
    "id": "3",
    "number": 3,
    "transliteration": "Ali 'Imran",
    "name": {
      "en": "Family of Imran",
      "ar": "آل عمران",
      "ur": "عمران کا خاندان"
    },
    "revelation": "medinan",
    "ayahCount": 200,
    "image": "surah_003.png"
  },
  {
    "id": "4",
    "number": 4,
    "transliteration": "An-Nisa",
    "name": {
      "en": "The Women",
      "ar": "النساء",
      "ur": "عورت"
    },
    "revelation": "medinan",
    "ayahCount": 176,
    "image": "surah_004.png"
  },
  {
    "id": "5",
    "number": 5,
    "transliteration": "Al-Ma'idah",
    "name": {
      "en": "The Table Spread",
      "ar": "المائدة",
      "ur": "دسترخوان"
    },
    "revelation": "medinan",
    "ayahCount": 120,
    "image": "surah_005.png"
  },
  {
    "id": "6",
    "number": 6,
    "transliteration": "Al-An'am",
    "name": {
      "en": "The Cattle",
      "ar": "الأنعام",
      "ur": "مویشی"
    },
    "revelation": "meccan",
    "ayahCount": 165,
    "image": "surah_006.png"
  },
  {
    "id": "7",
    "number": 7,
    "transliteration": "Al-A'raf",
    "name": {
      "en": "The Heights",
      "ar": "الأعراف",
      "ur": "اونچی جگہ"
    },
    "revelation": "meccan",
    "ayahCount": 206,
    "image": "surah_007.png"
  },
  {
    "id": "8",
    "number": 8,
    "transliteration": "Al-Anfal",
    "name": {
      "en": "The Spoils of War",
      "ar": "الأنفال",
      "ur": "مال غنیمت"
    },
    "revelation": "medinan",
    "ayahCount": 75,
    "image": "surah_008.png"
  },
  {
    "id": "9",
    "number": 9,
    "transliteration": "At-Tawbah",
    "name": {
      "en": "The Repentance",
      "ar": "التوبة",
      "ur": "توبہ"
    },
    "revelation": "medinan",
    "ayahCount": 129,
    "image": "surah_009.png"
  },
  {
    "id": "10",
    "number": 10,
    "transliteration": "Yunus",
    "name": {
      "en": "Jonah",
      "ar": "يونس",
      "ur": "یونس"
    },
    "revelation": "meccan",
    "ayahCount": 109,
    "image": "surah_010.png"
  },
  {
    "id": "11",
    "number": 11,
    "transliteration": "Hud",
    "name": {
      "en": "Hud",
      "ar": "هود",
      "ur": "حود"
    },
    "revelation": "meccan",
    "ayahCount": 123,
    "image": "surah_011.png"
  },
  {
    "id": "12",
    "number": 12,
    "transliteration": "Yusuf",
    "name": {
      "en": "Joseph",
      "ar": "يوسف",
      "ur": "یوسف"
    },
    "revelation": "meccan",
    "ayahCount": 111,
    "image": "surah_012.png"
  },
  {
    "id": "13",
    "number": 13,
    "transliteration": "Ar-Ra'd",
    "name": {
      "en": "The Thunder",
      "ar": "الرعد",
      "ur": "گرج"
    },
    "revelation": "medinan",
    "ayahCount": 43,
    "image": "surah_013.png"
  },
  {
    "id": "14",
    "number": 14,
    "transliteration": "Ibrahim",
    "name": {
      "en": "Abraham",
      "ar": "ابراهيم",
      "ur": "ابراہیم"
    },
    "revelation": "meccan",
    "ayahCount": 52,
    "image": "surah_014.png"
  },
  {
    "id": "15",
    "number": 15,
    "transliteration": "Al-Hijr",
    "name": {
      "en": "The Rocky Tract",
      "ar": "الحجر",
      "ur": "پتھر"
    },
    "revelation": "meccan",
    "ayahCount": 99,
    "image": "surah_015.png"
  },
  {
    "id": "16",
    "number": 16,
    "transliteration": "An-Nahl",
    "name": {
      "en": "The Bee",
      "ar": "النحل",
      "ur": "شہد کی مکھی"
    },
    "revelation": "meccan",
    "ayahCount": 128,
    "image": "surah_016.png"
  },
  {
    "id": "17",
    "number": 17,
    "transliteration": "Al-Isra",
    "name": {
      "en": "The Night Journey",
      "ar": "الإسراء",
      "ur": "رات کا صفر"
    },
    "revelation": "meccan",
    "ayahCount": 111,
    "image": "surah_017.png"
  },
  {
    "id": "18",
    "number": 18,
    "transliteration": "Al-Kahf",
    "name": {
      "en": "The Cave",
      "ar": "الكهف",
      "ur": "غار"
    },
    "revelation": "meccan",
    "ayahCount": 110,
    "image": "surah_018.png"
  },
  {
    "id": "19",
    "number": 19,
    "transliteration": "Maryam",
    "name": {
      "en": "Mary",
      "ar": "مريم",
      "ur": "مریم"
    },
    "revelation": "meccan",
    "ayahCount": 98,
    "image": "surah_019.png"
  },
  {
    "id": "20",
    "number": 20,
    "transliteration": "Taha",
    "name": {
      "en": "Ta-Ha",
      "ar": "طه",
      "ur": "طٰہٰ"
    },
    "revelation": "meccan",
    "ayahCount": 135,
    "image": "surah_020.png"
  },
  {
    "id": "21",
    "number": 21,
    "transliteration": "Al-Anbya",
    "name": {
      "en": "The Prophets",
      "ar": "الأنبياء",
      "ur": "پیغمبر"
    },
    "revelation": "meccan",
    "ayahCount": 112,
    "image": "surah_021.png"
  },
  {
    "id": "22",
    "number": 22,
    "transliteration": "Al-Hajj",
    "name": {
      "en": "The Pilgrimage",
      "ar": "الحج",
      "ur": "حج"
    },
    "revelation": "medinan",
    "ayahCount": 78,
    "image": "surah_022.png"
  },
  {
    "id": "23",
    "number": 23,
    "transliteration": "Al-Mu'minun",
    "name": {
      "en": "The Believers",
      "ar": "المؤمنون",
      "ur": "مومنین"
    },
    "revelation": "meccan",
    "ayahCount": 118,
    "image": "surah_023.png"
  },
  {
    "id": "24",
    "number": 24,
    "transliteration": "An-Nur",
    "name": {
      "en": "The Light",
      "ar": "النور",
      "ur": "نور"
    },
    "revelation": "medinan",
    "ayahCount": 64,
    "image": "surah_024.png"
  },
  {
    "id": "25",
    "number": 25,
    "transliteration": "Al-Furqan",
    "name": {
      "en": "The Criterion",
      "ar": "الفرقان",
      "ur": "صحیح اور غلط میں فرق کرنے والی کتاب"
    },
    "revelation": "meccan",
    "ayahCount": 77,
    "image": "surah_025.png"
  },
  {
    "id": "26",
    "number": 26,
    "transliteration": "Ash-Shu'ara",
    "name": {
      "en": "The Poets",
      "ar": "الشعراء",
      "ur": "شعراٗ"
    },
    "revelation": "meccan",
    "ayahCount": 227,
    "image": "surah_026.png"
  },
  {
    "id": "27",
    "number": 27,
    "transliteration": "An-Naml",
    "name": {
      "en": "The Ant",
      "ar": "النمل",
      "ur": "چیونٹی"
    },
    "revelation": "meccan",
    "ayahCount": 93,
    "image": "surah_027.png"
  },
  {
    "id": "28",
    "number": 28,
    "transliteration": "Al-Qasas",
    "name": {
      "en": "The Stories",
      "ar": "القصص",
      "ur": "قصے"
    },
    "revelation": "meccan",
    "ayahCount": 88,
    "image": "surah_028.png"
  },
  {
    "id": "29",
    "number": 29,
    "transliteration": "Al-'Ankabut",
    "name": {
      "en": "The Spider",
      "ar": "العنكبوت",
      "ur": "مکڑی"
    },
    "revelation": "meccan",
    "ayahCount": 69,
    "image": "surah_029.png"
  },
  {
    "id": "30",
    "number": 30,
    "transliteration": "Ar-Rum",
    "name": {
      "en": "The Romans",
      "ar": "الروم",
      "ur": "روم"
    },
    "revelation": "meccan",
    "ayahCount": 60,
    "image": "surah_030.png"
  },
  {
    "id": "31",
    "number": 31,
    "transliteration": "Luqman",
    "name": {
      "en": "Luqman",
      "ar": "لقمان",
      "ur": "لقمان"
    },
    "revelation": "meccan",
    "ayahCount": 34,
    "image": "surah_031.png"
  },
  {
    "id": "32",
    "number": 32,
    "transliteration": "As-Sajdah",
    "name": {
      "en": "The Prostration",
      "ar": "السجدة",
      "ur": "سجدہ"
    },
    "revelation": "meccan",
    "ayahCount": 30,
    "image": "surah_032.png"
  },
  {
    "id": "33",
    "number": 33,
    "transliteration": "Al-Ahzab",
    "name": {
      "en": "The Combined Forces",
      "ar": "الأحزاب",
      "ur": "متحد گروہ"
    },
    "revelation": "medinan",
    "ayahCount": 73,
    "image": "surah_033.png"
  },
  {
    "id": "34",
    "number": 34,
    "transliteration": "Saba",
    "name": {
      "en": "Sheba",
      "ar": "سبإ",
      "ur": "سبا"
    },
    "revelation": "meccan",
    "ayahCount": 54,
    "image": "surah_034.png"
  },
  {
    "id": "35",
    "number": 35,
    "transliteration": "Fatir",
    "name": {
      "en": "Originator",
      "ar": "فاطر",
      "ur": "پیدا کرنے والا"
    },
    "revelation": "meccan",
    "ayahCount": 45,
    "image": "surah_035.png"
  },
  {
    "id": "36",
    "number": 36,
    "transliteration": "Ya-Sin",
    "name": {
      "en": "Ya Sin",
      "ar": "يس",
      "ur": "یٰسٓ"
    },
    "revelation": "meccan",
    "ayahCount": 83,
    "image": "surah_036.png"
  },
  {
    "id": "37",
    "number": 37,
    "transliteration": "As-Saffat",
    "name": {
      "en": "Those who set the Ranks",
      "ar": "الصافات",
      "ur": "صف باندھنے والے"
    },
    "revelation": "meccan",
    "ayahCount": 182,
    "image": "surah_037.png"
  },
  {
    "id": "38",
    "number": 38,
    "transliteration": "Sad",
    "name": {
      "en": "The Letter \"Saad\"",
      "ar": "ص",
      "ur": "صٓ"
    },
    "revelation": "meccan",
    "ayahCount": 88,
    "image": "surah_038.png"
  },
  {
    "id": "39",
    "number": 39,
    "transliteration": "Az-Zumar",
    "name": {
      "en": "The Troops",
      "ar": "الزمر",
      "ur": "گروہ"
    },
    "revelation": "meccan",
    "ayahCount": 75,
    "image": "surah_039.png"
  },
  {
    "id": "40",
    "number": 40,
    "transliteration": "Ghafir",
    "name": {
      "en": "The Forgiver",
      "ar": "غافر",
      "ur": "بخشنے والا"
    },
    "revelation": "meccan",
    "ayahCount": 85,
    "image": "surah_040.png"
  },
  {
    "id": "41",
    "number": 41,
    "transliteration": "Fussilat",
    "name": {
      "en": "Explained in Detail",